published_date,title,description,polarity,sentiment,source,country_code,country_name
2025-05-09 05:05:00+00:00,Trump floats cutting Chinese tariffs from 145% to 80% before weekend talks | Trump tariffs,Donald Trump has floated cutting tariffs on China from 145% to 80% before a weekend meeting as he looks to de-escalate the trade war. Top US ...,-0.6249,negative,The Guardian,gb,United Kingdom
2025-04-02 07:00:00+00:00,Trump announces tariffs on goods entering US from NI and Ireland,"NI goods entering the US will face a 10% tariff, while those from the Republic will be hit with 20%.",0.0,neutral,BBC,gb,United Kingdom
2025-04-09 07:00:00+00:00,Full list of Trump’s tariffs: a country-by-country look after the 90-day pause,"Donald Trump announced a 90-day pause on tariffs for most countries except China, whose tariffs he raised to 125% on Wednesday.",0.0,neutral,The Guardian,gb,United Kingdom
2025-02-07 08:00:00+00:00,How tariffs are forecast to affect US stocks,Every five-percentage-point increase in the US tariff rate is estimated to reduce S&P 500 earnings per share by roughly 1-2%.,0.5423,positive,Goldman Sachs,us,United States
2025-02-28 08:00:00+00:00,Trump says US will impose additional 10% tariff on China,"Imports from China already face taxes at the border of at least 10%, after a Trump tariff order that went into effect earlier this month.",-0.296,negative,BBC,gb,United Kingdom
2025-05-08 20:26:06+00:00,Why the UK-US trade deal won’t herald a wider tariff climbdown,"The UK-US deals signals American flexibility, but we're sceptical about it translating into a wider de-escalation.",-0.2732,negative,ING Think,nl,Netherlands
2025-04-06 07:00:00+00:00,Zimbabwe to scrap tariffs on US goods in goodwill gesture to Trump,"President Mnangawa says he wants improved relations, days after Donald Trump said the US would impose an 18% tariff on Zimbabwe.",0.2263,positive,BBC,gb,United Kingdom
2025-04-03 07:00:00+00:00,UK drawing up list of items for potential retaliatory US tariffs,"In addition to the 10% tariffs, a 25% tariff has been put on UK car exports, as well as steel and aluminium products. Some products ...",0.2732,positive,BBC,gb,United Kingdom
2025-05-11 06:20:23+00:00,"Trump praises 'friendly, constructive' US-China trade talks","The US president claims there has been a ""total reset"" in trade relations following a day of talks between the nations.",0.765,positive,BBC,gb,United Kingdom
2025-04-03 07:00:00+00:00,World leaders criticise Trump tariffs as 'major blow',"Donald Trump's decision to impose new tariffs on all goods entering the US is a ""major blow to the world economy"", European Commission chief ...",-0.6249,negative,BBC,gb,United Kingdom
2025-04-22 07:00:00+00:00,"US to impose tariffs of up to 3,521% on south-east Asia solar panels","US trade officials are preparing to impose tariffs of up to 3,521% on imports of solar panels from four south-east Asian countries, while the ...",-0.5267,negative,The Guardian,gb,United Kingdom
2025-04-08 07:00:00+00:00,Trump's tariffs are a huge blow to Vietnam's economic ambitions,"US President Donald Trump's sweeping tariffs targeting most of the world are now in effect – and outside China, no other region has been hit ...",0.0258,neutral,BBC,gb,United Kingdom
2025-04-04 22:59:32+00:00,Trump tariffs latest: Worst week for US stocks since Covid as 10% tariffs on UK goods kick in,"Donald Trump imposed a 25% tariff on foreign-made cars as part of his economic plan to ""supercharge"" the US economy.",-0.6597,negative,BBC,gb,United Kingdom
2025-04-10 07:00:00+00:00,China says Trump’s trade war ‘will end in failure’ as Beijing tariffs take effect,China's 84% tariffs on US products come into force amid market relief after Trump pauses steep tariffs elsewhere.,-0.2023,negative,The Guardian,gb,United Kingdom
2025-04-02 07:00:00+00:00,Trump tariffs: Anger as Australia hit with 10% tax on exports,"Australia has been hit with a tariff of at least 10% on all exports to the US, as Donald Trump announced his new sweeping global trade ...",-0.5719,negative,BBC,gb,United Kingdom
2025-03-04 08:00:00+00:00,How is China hitting back against US tariffs?,China has set out a series of measures to kick in next week after the US introduced 10% tariffs on imports from the country.,0.0,neutral,BBC,gb,United Kingdom
2025-04-03 07:00:00+00:00,Trump tariff global reaction – country by country,Trump has imposed a 20% tariff on goods from the European Union. Mexico and Canada escaped Wednesday's whirlwind but will still be subject to 25 ...,-0.0387,neutral,The Guardian,gb,United Kingdom
2025-03-13 07:00:00+00:00,Trump threatens 200% tariff on alcohol from EU,"Wine and spirits will be taxed, Trump says, if the EU does not remove tariffs on US whiskey.",-0.3818,negative,BBC,gb,United Kingdom
2025-04-20 20:20:36+00:00,"Trump tariffs live updates: Beauty brands, Chinatown neighborhood markets in the US, and gaming companies brace for impact","US President Donald Trump on April 2 introduced a 25% tariff on car and truck imports and threatened a 24% tariff on all Japanese goods, though ...",0.2023,positive,Yahoo,us,United States
2025-04-11 07:00:00+00:00,What would a US-China trade war do to the world economy?,A full-scale trade war between China and the US is in prospect after President Donald Trump imposed 125% tariffs on Chinese goods imports.,-0.7845,negative,BBC,gb,United Kingdom
2024-12-13 08:00:00+00:00,Exposure of the Chinese economy to a US tariff hike,"Exports to the US accounted for 3.5% of China's GDP in 2018, in 2023 they represented 2.9% – a significant decline in a relatively short period of time.",0.2023,positive,CaixaBank Research,es,Spain
2025-04-04 07:00:00+00:00,Trump's tariffs and Africa: Agoa trade deal's future in question,"Some African countries got privileged access to US markets, but the future of that deal is uncertain.",-0.2144,negative,BBC,gb,United Kingdom
2025-04-10 07:00:00+00:00,Trump recognises tariff 'transition difficulty' as US markets fall again,The White House also confirmed that the tariffs on China would reach 145% due to a pre-existing 20% levy on fentanyl.,-0.3182,negative,BBC,gb,United Kingdom
2025-04-17 07:00:00+00:00,Trump's tariffs leave China's neighbours with an impossible choice,Ambitious economies like Vietnam and Indonesia are stuck between China and the US as the trade war escalates.,-0.128,negative,BBC,gb,United Kingdom
2025-04-17 07:00:00+00:00,Trump tariffs: Gold hits new record over US-China trade war fears,"Gold has jumped to a fresh high as investors fret over the impact of the trade war between the US and China. Spot gold touched $3,357.40 ...",-0.8519,negative,BBC,gb,United Kingdom
2025-04-10 07:00:00+00:00,S&P 500 sees one of biggest days since second world war after Trump levies pause – as it happened | Trump tariffs,"Global markets surged after Trump announced his 90-day tariff pause. The S&P 500 surged 5.6%, while the Nasdaq has jumped over 8%. Trump's Truth ...",-0.3818,negative,The Guardian,gb,United Kingdom
2025-04-10 07:00:00+00:00,Trump’s Tariff: A test to Malaysia’s trade resilience,THE United States (U.S.) President Donald Trump's sweeping decision to impose a 24% blanket tariff on Malaysian imports is more than just a ...,0.1531,positive,MalaysiaGazette,my,Malaysia
2025-04-09 07:00:00+00:00,Trump tariff updates: US president unveils 90-day pause for most countries,"United States President Donald Trump has announced he will raise tariffs against China to 125 percent, in a rapidly escalating trade war ...",-0.2075,negative,Al Jazeera,qa,Qatar
2025-04-11 07:00:00+00:00,"In trade war with the US, China holds a lot more cards than Trump may think − in fact, it might have a winning hand","Trump's tariffs may hurt, but this time China holds more cards − and could turn the pressure into a strategic advantage.",0.1406,positive,The Conversation,au,Australia
2025-04-07 07:00:00+00:00,Trump tariffs updates: US ‘not looking at’ pausing tariffs for trade talks,Trump reiterates China threat. The US president has reiterated that he would impose 50 percent tariffs on Chinese goods if Beijing does not ...,-0.6808,negative,Al Jazeera,qa,Qatar
2025-02-15 08:00:00+00:00,The bazooka diplomacy of Trump’s tariffs,"So far, Trump has introduced and then suspended a 25% tariff on Canada and Mexico, while imposing – and not suspending – an additional 10% ...",-0.5423,negative,CEPR,gb,United Kingdom
2025-04-13 07:00:00+00:00,Trump warns China ‘not getting off the hook’ on US tariffs for electronics,"Trump exempts smartphones, computers from 'reciprocal' tariffs. The latest exemptions cover imports from China, in first sign of possible ...",-0.1027,negative,Al Jazeera,qa,Qatar
2025-05-08 17:09:48+00:00,"Donald Trump has reduced tariffs on British metals and cars, but how important is this trade deal? Experts react","Donald Trump has reduced tariffs on British metals and cars, but how important is this trade deal? Experts react. Published: May 8, 2025 1:09pm ...",0.5803,positive,The Conversation,au,Australia
2024-12-11 08:00:00+00:00,The consequences of Trump’s tariff threats,"For the U.S. and its trading partners, Trump's tariff threats poses a slew of economic, strategic, and institutional risks.",-0.7717,negative,Brookings,us,United States
2025-04-09 07:00:00+00:00,Trump’s tariff war: What’s at stake for China’s economy?,"On February 3, Trump imposed an extra 10 percent tariff on all goods from China, on top of various tariffs levied during the first Trump ...",-0.5267,negative,Al Jazeera,qa,Qatar
2024-11-26 08:00:00+00:00,"Canada, Mexico and China respond to Trump tariff threats",Trump vowed on Monday night to introduce 25% tariffs on goods coming from Mexico and Canada and an additional 10% on goods coming from China. He ...,-0.4215,negative,BBC,gb,United Kingdom
2025-04-09 07:00:00+00:00,Trump rips up rulebook on trade and businesses are left reeling,"Firms say the rapid change in US trade policy, including big taxes on China, has left them in flux.",0.0,neutral,BBC,gb,United Kingdom
2025-03-05 08:00:00+00:00,Trump tariffs: China is a manufacturing superpower - can tariffs change that?,"Can Trump's tariffs hurt China's factories? Yes, analysts say. Exports have been the ""saving grace"" of China's economy and if the taxes linger, ...",0.3527,positive,BBC,gb,United Kingdom
2025-04-08 07:00:00+00:00,Donald Trump threatens new 50% tariffs on China,"Donald Trump has threatened China with an extra 50% tariff on goods imported into the US if it does not withdraw its 34% counter-tariff, ...",-0.6808,negative,BBC,gb,United Kingdom
2025-02-04 08:00:00+00:00,China unveils US tariffs and Google investigation in response to Trump levies,"China unveils US tariffs and Google investigation in response to Trump levies · In 2023, the US goods trade deficit with China reached $279bn.",-0.3182,negative,The Guardian,gb,United Kingdom
2025-04-17 10:54:06+00:00,Trump includes US troop costs in tariff talks with Asian allies,"Trump signals new talks on defence cost-sharing with South Korea and Japan, framing alliances as transactional deals. South Korea and Japan ...",0.1027,positive,astroawani.com,my,Malaysia
2025-04-02 07:00:00+00:00,New modelling reveals full impact of Trump’s ‘Liberation Day’ tariffs – with the US hit hardest,Modelling of how Trump's tariffs will hit global trade suggests the US will be the biggest loser – while a few nations may emerge as ...,-0.5267,negative,The Conversation,au,Australia
2025-04-10 07:00:00+00:00,"Trump trade war with China revives recession, bear market fears","China has been raising its tariffs on the U.S. with each Trump increase, raising fears that Beijing may jack up tariffs above the current 84%.",-0.8126,negative,Reuters,intl,International
2025-04-10 07:00:00+00:00,Trump-China tariff war: What could the US gain and lose?,Trump's 125 percent tariffs on Chinese imports come into force amid market relief after Trump pauses steep levies elsewhere.,-0.0258,neutral,Al Jazeera,qa,Qatar
2025-02-03 08:00:00+00:00,Trump's 10% tariff on China begins as Beijing plans retaliation on US energy and some cars,"A US levy of 10% on Chinese imports has started today, which resulted in Beijing announcing retaliatory tariffs on a raft of American products.",0.2732,positive,BBC,gb,United Kingdom
2024-11-26 08:00:00+00:00,"Trump threatens China, Mexico and Canada with new tariffs","During his election campaign, Trump threatened Mexico and China with tariffs of up to 100%, if he deemed them necessary, much higher than those ...",-0.6808,negative,BBC,gb,United Kingdom
2025-04-08 07:00:00+00:00,A growing trade war? Trump says China ‘wants to make a deal’,Top US trade official suggests Beijing has not sought talks with Washington as deadline for additional tariffs looms.,-0.4588,negative,Al Jazeera,qa,Qatar
2025-02-03 08:00:00+00:00,Trump agrees to pause tariffs on Canada and Mexico but not on China,"President Donald Trump has agreed to hold off imposing 25% tariffs on Canada and Mexico for 30 days, pulling the North American neighbours ...",0.3506,positive,BBC,gb,United Kingdom
2025-04-15 07:00:00+00:00,Trump tariffs: US orders from Chinese small businesses on hold,Trump proposes 80% China tariff ahead of trade talks. The meeting is the strongest sign yet that the world's two biggest economies are ready to ...,0.6597,positive,BBC,gb,United Kingdom
2025-04-04 07:00:00+00:00,China imposes 34% reciprocal tariffs on imports of US goods in retaliation for Trump’s trade war,"China said Friday that it will impose reciprocal 34% tariffs on all imports from the United States from April 10, making good on a promise ...",0.128,positive,CNN,us,United States
2025-02-04 08:00:00+00:00,Trump tariffs: Beijing hits back – can China and US avoid trade war escalation?,Trump proposes 80% China tariff ahead of trade talks. The meeting is the strongest sign yet that the world's two biggest economies are ready to ...,-0.1779,negative,BBC,gb,United Kingdom
2025-02-01 08:00:00+00:00,"Trump launches trade war with tariffs on Mexico, Canada and China","In three executive orders, Trump imposed 25% tariffs on Mexican and most Canadian imports and 10% on goods from China, starting on Tuesday. He ...",-0.6369,negative,Reuters,intl,International
2025-04-10 07:00:00+00:00,Trump trade advisor says stock market plunge 'No big deal': Live updates,President Donald Trump's 145% tariffs on China are reshaping global trade dynamics and regional alliances.,0.2732,positive,CNBC,us,United States
2025-04-04 07:00:00+00:00,China hits back hard at ‘bullying’ Trump tariffs as global recession fears grow,"Beijing imposes punitive 34% extra tariffs on all goods imported from US, exacerbating stock market sell-off.",-0.8658,negative,The Guardian,gb,United Kingdom
2025-04-08 07:00:00+00:00,China is not backing down from Trump's tariff war. What next?,Trump proposes 80% China tariff ahead of trade talks. The meeting is the strongest sign yet that the world's two biggest economies are ready to ...,0.1093,positive,BBC,gb,United Kingdom
2025-04-08 07:00:00+00:00,China vows to ‘fight to the end’ against latest Trump tariff threat,Beijing accuses US of blackmail and adding a 'mistake on top of a mistake' as Wednesday deadline for latest levies looms.,-0.8555,negative,The Guardian,gb,United Kingdom
2025-04-08 07:00:00+00:00,US v. them: Trump’s tariffs and his economic vision of dominance,US President Donald Trump's April 2 announcement of sweeping new tariffs against numerous countries isn't just driven by (already ...,0.4215,positive,The Conversation,au,Australia
2025-04-06 07:00:00+00:00,'Sometimes you have to take medicine': Trump defends sweeping tariffs,"US President Donald Trump has defended sweeping tariffs on imports that sent shockwaves through global stock markets, saying ""sometimes you ...",0.0,neutral,BBC,gb,United Kingdom
2025-02-07 08:00:00+00:00,What do Trump’s tariffs mean for US-China trade?,The US president hopes tariffs will help close the huge trade gap by potentially pressuring Beijing into a new deal.,0.6597,positive,The Guardian,gb,United Kingdom
2025-01-22 08:00:00+00:00,Donald Trump considers 10% tariff on China from February,US President Donald Trump has said he is considering imposing a 10% tariff on imports of Chinese-made goods as soon as 1 February.,-0.1027,negative,BBC,gb,United Kingdom
2025-02-14 08:00:00+00:00,"Trump orders up a plan for more tariffs, even as inflation heats up","President Donald Trump doubled down on his extraordinary push for more balanced trade, ordering on Thursday that agencies should investigate ...",0.0,neutral,CNN,us,United States
2025-01-22 08:00:00+00:00,Trump delivers fresh tariff threats against EU and China,US President Donald Trump on Tuesday vowed to hit the European Union with tariffs and said his administration was discussing a 10% punitive duty on Chinese ...,-0.5859,negative,Reuters,intl,International
2024-11-09 08:00:00+00:00,‘Tariff man’ Trump puts Britain in firing line of new global trade war,Donald Trump's US election campaign threat to impose 10% levies on US trading partners could hurt the UK economy.,-0.936,negative,The Guardian,gb,United Kingdom
2025-04-09 07:00:00+00:00,Trump's tariffs: China retaliates with 84% levy,"China's finance ministry has announced an 84% tariff on goods imported from the US, retaliating against recent levies imposed by the White ...",-0.0772,negative,BBC,gb,United Kingdom
2024-12-12 08:00:00+00:00,"No trade tax is free: Trump’s promised tariffs will hit large flows of electronics, machinery, autos, and chemicals","On the campaign trail, Trump promised tariffs on all imports from 10 to 20 percent, with a special rate of 60 percent on all imports from China.",0.8316,positive,Peterson Institute for International Economics,us,United States
2025-03-19 07:00:00+00:00,Trump tariffs: Will import duty war push India to open its markets?,"The jury is out on whether Trump's tariff war will help India break free or double down on protectionism. Narendra Modi's government, often ...",-0.4215,negative,BBC,gb,United Kingdom
2025-03-05 08:00:00+00:00,China says it is ready for 'any type of war' with US,"China has warned the US it is ready to fight ""any type"" of war after hitting back against President Donald Trump's mounting trade tariffs.",-0.8176,negative,BBC,gb,United Kingdom
2025-02-13 08:00:00+00:00,Trump launches plan to target countries with 'reciprocal' tariffs,US President Donald Trump is sharpening plans to hit exports from countries that he says have trade policies that are unfair to the US.,-0.4767,negative,BBC,gb,United Kingdom
2025-04-08 07:00:00+00:00,Trump threatens to hike China tariffs further as market plunge continues,"Trump threatens to further hike China tariffs; EU floats 25% counter-tariffs; Asian and European stocks plunge, US Dow and S&P indexes end ...",-0.6369,negative,Reuters,intl,International
2025-02-14 11:47:37+00:00,What are reciprocal tariffs? Trump's trade agenda explained,"US President Donald Trump recently ordered his officials to develop reciprocal tariffs on imports to the United States, keeping to an ""eye for an eye"" campaign ...",0.4215,positive,DW,de,Germany
2025-02-10 08:00:00+00:00,Donald Trump says he will announce tariffs on steel and aluminium,"President Donald Trump has said he will announce a 25% import tax on all steel and aluminium entering the US, a move that will have the ...",0.0,neutral,BBC,gb,United Kingdom
2025-04-09 07:00:00+00:00,Stocks soar as Trump pauses some tariffs for talks,"US shares have rocketed after US President Donald Trump said he would suspend steep tariffs on goods from most countries, and instead impose ...",-0.3182,negative,BBC,gb,United Kingdom
2025-02-02 08:00:00+00:00,"US taxes imports from Canada, Mexico and China as Trump's tariffs begin",Trump said a levy of 25% on Canadian and Mexican imports as well as an additional 10% tax on Chinese goods would come into force on Tuesday.,0.2732,positive,BBC,gb,United Kingdom
2025-02-03 08:00:00+00:00,Trump agrees to postpone Canada and Mexico tariffs by one month,Trump agrees to postpone Canada and Mexico tariffs by one month. President delays threatened 25% tariffs on US neighbors but China still to face 10% levy on ...,-0.2732,negative,The Guardian,gb,United Kingdom
2025-03-31 07:00:00+00:00,Trump tariffs: Global shares slide as new US import taxes loom,The US president suggests the new import taxes he is set to announce this week will hit all countries.,0.0772,positive,BBC,gb,United Kingdom
2025-03-04 08:00:00+00:00,Trudeau says US wants to collapse Canada's economy with tariffs,"Canada has imposed its own retaliatory tariffs, which will remain in place until the US reverses course.",-0.5423,negative,BBC,gb,United Kingdom
2025-02-01 08:00:00+00:00,"Trump: Nothing Canada, Mexico or China can do to delay Feb 1 tariffs",US President Donald Trump said on Friday he would impose hefty new tariffs of 25% on goods from Mexico and Canada and 10% on imports from China.,-0.5423,negative,Reuters,intl,International
2025-04-10 07:00:00+00:00,Why did Trump retreat on tariffs and is the market reaction justified?,"Accusations of insider trading, market manipulation and corruption more broadly are being levelled at the White House as Trump switches tactics.",0.0,neutral,The Guardian,gb,United Kingdom
2025-04-14 07:00:00+00:00,"Trump tariffs: Singapore to form task force to help businesses and workers, says PM Wong",Singapore will form a national task force to support businesses and workers in response to sweeping new US tariffs that could slow economic ...,0.6597,positive,Singapore Economic Development Board (EDB),sg,Singapore
2025-04-05 07:00:00+00:00,"ST Explains: What Trump’s tariffs are, and how they could affect growth in Singapore and more","A fresh “baseline tariff” of 10 per cent will apply to all goods imported into the US from around the world, including Singapore, with steeper “ ...",0.6344,positive,The Straits Times,sg,Singapore
2024-11-20 08:00:00+00:00,Commentary: Implications of Trump’s policies for Singapore’s economy,Trump has promised tax cuts for corporations and individuals. This will result in revenue losses that would not be made up for by tariff ...,-0.34,negative,CNA,sg,Singapore
2025-04-04 12:18:05+00:00,Trump tariffs live updates: China eases tariffs on select US goods as Trump says Beijing will 'eat’ the costs,Countermeasures escalate as China increases its tariffs to 84% on U.S. goods and Trump's 104% duties take effect. April 9. President Trump announces a 90-day ...,0.3182,positive,Yahoo,us,United States
2025-04-08 07:00:00+00:00,Ministerial Statement by PM Lawrence Wong on the US Tariffs and Implications,Ministerial statement by Prime Minister and Minister for Finance Lawrence Wong on the US tariffs and their implications on 8 April 2025.,0.0,neutral,Prime Minister's Office Singapore,sg,Singapore
2025-04-03 07:00:00+00:00,"Trump tariffs: Hitting close partner Singapore ‘a surprise’, says ex-senior US trade official","The latest batch of tariffs comes on top of 25 per cent tariffs on imports of steel and aluminium, which took effect on March 12, and the same ...",0.2023,positive,The Straits Times,sg,Singapore
2025-05-09 19:30:00+00:00,US and China meet in bid to 'de-escalate' trade war,WASHINGTON: Senior US and Chinese officials met in Geneva on Saturday (May 10) in a bid to de-escalate a trade war sparked by President ...,-0.8316,negative,CNA,sg,Singapore
2025-04-10 07:00:00+00:00,"US tariff pause: Trump tries to unite the world against China, calm stock markets","“Based on the lack of respect that China has shown to the world's markets, I am hereby raising the tariff charged to China by the United States ...",0.6249,positive,The Straits Times,sg,Singapore
2025-04-11 07:00:00+00:00,"China hits back at Trump tariff hike, raises duties on US goods to 125%","China hits back at Trump tariff hike, raises duties on US goods to 125%. China also blasted US President Donald Trump's tariffs as a ""numbers ...",0.0,neutral,CNA,sg,Singapore
2025-04-10 07:00:00+00:00,What just happened? Making sense of Trump’s tariff pause,President Trump announced a 90-day pause on what the administration termed “reciprocal” tariffs on imports from almost 60 countries and the ...,0.0,neutral,The Straits Times,sg,Singapore
2025-04-04 07:00:00+00:00,The Impact of Tariffs on Vietnamese Exports: US-Vietnam Trade Relations Under Trump 2.0,"The US has announced a reciprocal tariff rate of 46 percent on all Vietnamese products, a move that is expected to significantly impact ...",0.0,neutral,Vietnam Briefing,vn,Vietnam
2025-02-18 08:00:00+00:00,What we know about Trump’s reciprocal tariffs – and what we don’t,Trump said on Thursday he does not expect trading partners to change their tariff rates in response to the US imposition of reciprocal tariff ...,0.0,neutral,Hinrich Foundation,hk,Hong Kong
2025-01-08 08:00:00+00:00,Tariffs 101: What you need to know about tariffs in the new Trump era,President-elect Trump pronounced via social media that he plans to impose a 25% tariff on all products imported into the United States from Canada and Mexico.,0.1531,positive,Norton Rose Fulbright,gb,United Kingdom
2025-04-25 07:00:00+00:00,Conflicting US-China talks statements add to global trade confusion,"""China and the U.S. are NOT having any consultation or negotiation on #tariffs,"" China shot back in a foreign ministry statement posted by the ...",-0.5994,negative,Reuters,intl,International
