published_date,title,description,polarity,sentiment,source,country_code,country_name
2025-05-20 12:00:07+00:00,‘Not a real remedy’: Chinese crane maker raises questions over US tariff plans,Company says higher duties on Chinese cranes would just increase costs for American ports. The US ports association agrees.,0.4767,positive,South China Morning Post,hk,Hong Kong
2025-05-21 03:50:00+00:00,China-US trade soars as exporters race to hit tariff truce window,"In the week beginning May 12, bookings on freighters from China to US more than doubled from prior week. Read more at straitstimes.com.",0.0,neutral,The Straits Times,sg,Singapore
2025-05-21 08:22:30+00:00,Trump tariffs live updates: Importers rush to turn US warehouses into tariff-free zones,"Donald Trump's wide-ranging tariffs on Chinese imports are expected to remain at 30%, down from the 145% previously touted, after the current 90 ...",-0.0516,negative,Yahoo Finance,us,United States
2025-05-21 03:28:00+00:00,US importers race to create bonded warehouses amid Trump tariffs,"The U.S. has more than 1,700 bonded warehouses, facilities where imported goods can be held without immediate payment of customs duties such as ...",0.2732,positive,Reuters,intl,International
2025-05-15 03:04:00+00:00,Indonesia Changes Trade Data Release Schedule Amid US Tariff Review,"Indonesia ends mid-month trade estimates, will release only final monthly data as March trade surplus hits $4.33B amid US tariff tension.",-0.3182,negative,Jakarta Globe,id,Indonesia
2025-05-14 13:17:06+00:00,"US smartphone shipments rose 30% in March due to tariff concerns, report says","Smartphone shipments to the U.S. surged 30% in March as manufacturers Apple , Samsung and Motorola rushed to bring more devices into the ...",0.0,neutral,Reuters,intl,International
2025-05-16 14:56:11+00:00,South Korea minister says deadline tight to reach deal on US tariffs,South Korea aims for tariff deal with U.S. by July deadline · Political turmoil in South Korea may delay trade deal · Technical talks to focus on ...,-0.5719,negative,Reuters,intl,International
2025-05-16 05:09:39+00:00,Dovish BOJ policymaker urges pause in rate hikes on US tariff uncertainty,"The Bank of Japan must hold off raising interest rates for the time being, its board member Toyoaki Nakamura said on Friday, warning of ...",-0.2023,negative,Reuters,intl,International
2025-05-20 08:07:43+00:00,Tariffs live updates: LA port shipments plunge 30% in May amid Trump tariff fallout,"Donald Trump's wide-ranging tariffs on Chinese imports are expected to remain at 30%, down from the 145% previously touted, after the current 90 ...",-0.0516,negative,Yahoo Finance,us,United States
2025-05-19 10:09:18+00:00,G-7 finance leaders to seek US consensus on non-tariff issues at Canada meeting,"G7 members Japan, Germany, France and Italy all face a potential doubling of U.S. ""reciprocal"" duties to 20% or more in early July. Britain ...",0.0,neutral,The Straits Times,sg,Singapore
2025-05-20 08:02:17+00:00,Philippines can cope with US tariffs’ impact: Globe Telecom CEO,"The Philippines could withstand the impact of US tariffs due to its high levels of domestic consumption, the new CEO of Globe Telecom has ...",0.0,neutral,South China Morning Post,hk,Hong Kong
2025-05-19 10:00:00+00:00,"China tariffs are no longer 145%, but for small businesses in the crossfire, ‘it’s still awful’",President Donald Trump's decision to impose a steep tax on most goods that come into America has tested the mettle of small business owners ...,-0.5267,negative,CNN,us,United States
2025-05-15 19:49:55+00:00,US stocks are forecast to rally amid China tariff discussions,US stocks are expected to climb more than 10% in the next 12 months as the Trump administration's most severe tariff outcomes seem likely to ...,-0.4391,negative,Goldman Sachs,us,United States
2025-05-21 00:00:00+00:00,"Aberdeen Sounds Alarm on US Stocks, Diversifies Global Equities as Trump Tariffs Loom","Aberdeen is advising clients to reduce US equity exposure as uncertainty over ""Trump tariffs"" casts a shadow over global markets, according to ...",-0.6908,negative,Nation Thailand,th,Thailand
2025-05-15 17:45:38+00:00,History of U.S. tariffs and why it matters today,"Explore the history of U.S. tariffs from the Tariff of 1789 to the Smoot-Hawley Act, and understand their impact on today's economic ...",0.0258,neutral,Thomson Reuters tax and accounting,us,United States
2025-05-14 12:00:00+00:00,United States and China Agree to Partially De-escalate April Tariffs,"On or around August 12, 2025, the 10% retaliatory tariff would increase to 34%, unless the two countries negotiate another tariff suspension.",0.765,positive,White & Case LLP,us,United States
2025-05-14 23:02:00+00:00,Tax changes to cushion blow of US tariffs,"Thai entrepreneurs, especially exporters, are worried about Washington's trade policy after Trump decided to slap a 36% tariff on Thai imports, ...",-0.2177,negative,Bangkok Post,th,Thailand
2025-05-21 09:48:00+00:00,"US tariffs expected to drive 15-20% rise in demand for manufacturing space in Vietnam, Indonesia: Knight Frank","Occupiers are likely to prefer flexible leases, hedge their geographical exposure and go for cost-optimised, demand-resilient markets.",0.1027,positive,The Business Times,sg,Singapore
2025-05-14 12:46:09+00:00,Germany's Merck drops China surcharge on orders after US-China tariff deal,"The agreement, announced on Monday, will see U.S. tariffs on Chinese goods fall to 30% from 145% for 90 days, while China will reduce tariffs on ...",0.4939,positive,Reuters,intl,International
2025-05-21 02:36:00+00:00,"Japan's exports slow, shipments to US fall as tariffs bite","Imports fell 2.2% in April from a year earlier, less than a 4.5% drop expected by analysts. As a result, Japan marked a trade deficit of 115.8 ...",-0.5859,negative,Reuters,intl,International
2025-05-20 05:01:07+00:00,"Japan holds firm on demand for US tariff elimination in trade talks, warning against rushed deal","On April 2, US President Donald Trump imposed 10 per cent tariffs on all countries except Canada, Mexico and China, along with higher tariff ...",-0.4939,negative,Malay Mail,my,Malaysia
2025-05-19 09:30:36+00:00,Tariffs live updates: Bessent says tariffs may return to 'reciprocal' levels if deals aren't made,"Donald Trump's wide-ranging tariffs on Chinese imports are expected to remain at 30%, down from the 145% previously touted, after the current 90 ...",-0.0516,negative,Yahoo Finance,us,United States
2025-05-20 07:48:00+00:00,Cabinet approves B157bn to counter US tariff impact,The cabinet has reallocated 157 billion baht ($4.7 billion) of budget spending away from a consumer stimulus scheme to fund projects in the ...,0.4019,positive,Bangkok Post,th,Thailand
2025-05-15 13:55:43+00:00,Trump tariffs: Irish exports to US surged 400% in March,Ireland's goods exports to the United States increased by almost 400% in March as manufacturers raced to get products into the country ahead ...,0.5994,positive,BBC,gb,United Kingdom
2025-05-17 11:42:37+00:00,FOCUS: Japan carmakers focus on popular models to soften U.S. tariff impact,"Japanese automakers have few immediate options to offset the impact of the additional U.S. tariff on cars. Toyota Motor Corp., Honda Motor ...",0.4215,positive,Kyodo News+ | Japan's leading news agency.,jp,Japan
2025-05-15 16:11:21+00:00,"Trump tariffs live updates: Trump claims India offered zero tariffs, urges Apple to stay in US",President Trump on Thursday claimed India has offered to drop tariffs on US goods as part of a potential trade deal.,-0.2732,negative,Yahoo Finance,us,United States
2025-05-20 07:33:00+00:00,Japan seeks removal of US tariffs in trade talks,"Japan's economy is particularly vulnerable to US tariffs, with automotive exports being a critical sector that faces a potential 25% tariff rate ...",-0.5413,negative,Tech in Asia,sg,Singapore
2025-05-19 22:17:00+00:00,Firms wary of debt amid US tariff woes,Companies have postponed the drawing down of new credit lines as they await clarity on US tariffs following the announcement of the 90-day ...,-0.128,negative,Bangkok Post,th,Thailand
2025-05-15 05:45:25+00:00,"Malaysia-US tariff negotiations going smoothly, many issues can be resolved, says Zafrul","Discussions between Malaysia and the US regarding reciprocal tariffs have so far proceeded smoothly, with many issues being resolved while ...",0.34,positive,The Edge Malaysia,my,Malaysia
2025-05-16 07:51:14+00:00,Malaysia’s export base to cushion US tariff impact - BNM,"Malaysias economy grew by 4.4 pct in Q1 2025, supported by strong household spending and government policies. Tourism is expected to boost the ...",0.8074,positive,astroawani.com,my,Malaysia
2025-05-15 04:02:48+00:00,APEC warns of US tariff impact on trade as members seek deals with US,"The US has imposed sweeping tariffs on many APEC members and is challenging the WTO, affecting trade dynamics in the region. APEC trade ...",0.25,positive,astroawani.com,my,Malaysia
2025-05-19 05:25:47+00:00,US eyes region-based tariffs for many nations as deadline nears,"Trump imposed a 10 pct baseline tariff globally and higher tariffs on major trade surplus countries, pausing them for 90 days to allow talks.",0.1531,positive,astroawani.com,my,Malaysia
2025-05-21 03:30:04+00:00,Global retailers' tariff strategy risks spreading pain beyond US consumer,Global retailers are spreading US tariff costs by raising prices not just in the US but also in other markets like Europe and the UK. This ...,0.1406,positive,astroawani.com,my,Malaysia
2025-05-19 06:19:50+00:00,"So, China should consume more and the US less?","AI Brief. China's sluggish domestic spending highlights its struggle to shift from an export-driven economy, affecting regional markets.",-0.6124,negative,astroawani.com,my,Malaysia
2025-05-21 06:52:23+00:00,"Mexico's US auto exports to benefit from tariff discounts, minister says","Mexico, under USMCA, can reduce Trump's 25 pct car tariff by proving US parts content, easing the hit on auto exports to the US.",0.6124,positive,astroawani.com,my,Malaysia
2025-05-21 03:34:04+00:00,"Ringgit opens higher against greenback on weaker US economic outlook, tariff concerns","Ringgit rises on strong exports, while US economic uncertainty and rating downgrade weigh on dollar; BNM holds off rate cut.",-0.4767,negative,astroawani.com,my,Malaysia
2025-05-15 01:25:32+00:00,Malaysia should leverage US-China tariff pause to reposition itself - Economists,"A proactive approach will help Malaysia manage trade uncertainties and seize emerging global opportunities, economist says.",0.6908,positive,astroawani.com,my,Malaysia
2025-05-20 05:02:53+00:00,US tariffs seen having limited impact on Sarawak - Mussen,"Sarawak says US tariffs will have minimal impact, as key exports like LNG and palm oil mainly go to Asia, not the US.",0.1531,positive,astroawani.com,my,Malaysia
2025-05-16 08:45:12+00:00,"Shein to set up huge Vietnam warehouse in US tariff hedge, sources say","Shein is leasing 15 hectares for a warehouse near Ho Chi Minh City, Vietnam, as it shifts operations amid US-China trade tensions. - REUTERS.",-0.1027,negative,astroawani.com,my,Malaysia
2025-05-18 14:48:37+00:00,"After US tariff shock, Cannes Film Market is cautiously business-as-usual","Indie filmmakers face post-pandemic and strike-related challenges, navigating tariff concerns and shifting priorities for investment and ...",-0.3182,negative,astroawani.com,my,Malaysia
2025-05-15 09:54:15+00:00,EU trade officials see signs of optimism for US tariff deal,"“Trade conflicts are harmful; they slow down the exchange of goods, they slow down economic growth, and in the end there are no winners,” German ...",0.3182,positive,The Edge Malaysia,my,Malaysia
2025-05-20 06:02:18+00:00,"US tariff to have limited impact on Sarawak, says state official",The recent tariff imposed by the US is expected to have a limited impact on Sarawak's economy due to the export destinations of Sarawak's ...,-0.4767,negative,Free Malaysia Today,my,Malaysia
2025-05-20 12:38:06+00:00,"Trade disputes should be resolved as quickly as possible, Germany says ahead of G7","Germany warns US tariffs threaten jobs as the EU seeks a trade deal, while G7 leaders focus on Ukraine aid and rebuilding efforts.",-0.5267,negative,astroawani.com,my,Malaysia
2025-05-16 09:24:16+00:00,"China-US 90-day tariff truce should be extended, Global Times says","During the Geneva summit, the U.S. agreed to cut the extra tariffs it imposed on Chinese imports last month to 30% from 145% for the next three ...",-0.0772,negative,astroawani.com,my,Malaysia
2025-05-14 22:41:15+00:00,Economists believe 10% baseline US tariffs will stay,"“Nevertheless, we have to be prepared to accept the 10% baseline tariff and make some concessions to achieve a win-win outcome as long standing ...",0.5423,positive,thestar.com.my,my,Malaysia
2025-05-19 03:37:47+00:00,"Facing US tariffs, Penang turns to Asia and Europe to secure its economic future","GEORGE TOWN, May 19 — Penang is exploring alternative markets in Asia and Europe to reduce its dependence on the United States, ...",0.6369,positive,Malay Mail,my,Malaysia
2025-05-15 07:59:24+00:00,"APEC warns of tariff impact on trade as China, US trade reps meet",APEC forecasts regional exports to rise this year and lowers its economic growth estimate due to weak demand and trade uncertainty. The US has ...,-0.6249,negative,astroawani.com,my,Malaysia
2025-05-15 09:23:25+00:00,Cambodia holds trade talks with US as 49% tariff weighs on outlook,Cambodia risks economic harm if it can't reduce a steep 49 pct US tariff on its vital textile and footwear exports. Trade talks between Cambodia ...,-0.5267,negative,astroawani.com,my,Malaysia
2025-05-17 04:58:30+00:00,US hits Indonesia with tariffs - Will nickel be its Trump card?,Countries like China and Indonesia are using their control over critical minerals as leverage amid rising US tariffs and trade tensions.,-0.3612,negative,astroawani.com,my,Malaysia
2025-05-15 02:26:15+00:00,US-China trade respite eases EU fears of being flooded with Chinese goods,"A 90-day easing of US-China trade tensions is seen as positive, but US tariffs on Chinese goods remain high at 30 pct, still distorting trade.",-0.2382,negative,astroawani.com,my,Malaysia
2025-05-18 23:39:17+00:00,Tariffs: Will a US-China deal foil India's factory ambitions?,"The US-China trade ""reset"" could stall the manufacturing investment coming into India, say experts.",-0.2023,negative,BBC,gb,United Kingdom
2025-05-19 07:27:20+00:00,Thailand cuts 2025 growth forecast as US tariff threat looms and Chinese tourism dips,"BANGKOK, May 19 — Thailand has downgraded its 2025 economic forecast due to uncertainty over trade tariffs threatened by US President Donald ...",-0.8402,negative,Malay Mail,my,Malaysia
2025-05-16 00:18:00+00:00,Japan's economy shrinks as US tariff hit looms,"TOKYO: Japan's economy shrank for the first time in a year in the March quarter, data showed on Friday, underscoring the fragile nature of ...",-0.1531,negative,thestar.com.my,my,Malaysia
2025-05-20 06:17:28+00:00,US tariff risks cloud PIE Industrial’s growth outlook as analysts turn cautious,"Despite recent rebound, PIE Industrial is still down by nearly 30% so far this year on Bursa Malaysia, as international trade tensions and the ...",-0.3818,negative,The Edge Malaysia,my,Malaysia
2025-05-20 05:05:47+00:00,"US tariff expected to have limited direct impact on Sarawak’s economy, says deputy minister","“Sarawak's exports to the US amounted to RM1.2 billion in 2023. These total exports only contributed 0.9 per cent to Sarawak's total exports, ...",-0.2263,negative,Borneo Post Online,my,Malaysia
2025-05-14 16:12:16+00:00,Trump tariffs live updates: Trump's pause on China tariffs still a 'nightmare' for small businesses,"The move by the Trump administration to lower tariffs on goods from China to 30% from 120%, still offers limited reprieve for US small ...",-0.4767,negative,Yahoo Finance,us,United States
2025-05-15 11:36:23+00:00,"China, US at impasse over who should start trade talks","China's commerce ministry spokesperson says, the country is open to economic and trade consultations with the United States.",0.4215,positive,astroawani.com,my,Malaysia
2025-05-20 05:02:53+00:00,"Australia to stay tariff-free for Pacific Islands struggling with aid cuts, says foreign minister","Foreign Minister Penny Wong promises continued tariff-free access for Pacific exports to Australia, after Fiji faced a 32 pct US tariff.",-0.34,negative,astroawani.com,my,Malaysia
2025-05-20 00:30:00+00:00,Government outline positive expectations of US tariff negotiations,The Cambodian government expects its efforts to yield positive results as it engages in bilateral tariff negotiations with the US.,0.8481,positive,Nation Thailand,th,Thailand
2025-05-18 12:35:00+00:00,"US tariffs does pose short-term threat, Asean resilience will prevail over long term, say experts","""An immediate impact of the tariffs is higher prices, which in turn lead to lower demand for most goods, resulting in a decline in exports from ...",-0.7269,negative,thestar.com.my,my,Malaysia
2025-05-21 00:13:13+00:00,US tariffs to have ‘limited’ impact on S’wak economy,"KUCHING: The reciprocal tariffs announced by the United States will have a limited impact on Sarawak's economy and trade relations, ...",0.2263,positive,thestar.com.my,my,Malaysia
2025-05-21 02:07:21+00:00,"Australia seeks deeper relations with Malaysia, Asean as US appears set to keep 10% base tariff","Australia is actively pursuing closer economic ties with Asean, particularly Malaysia, a country its Trade and Tourism Minister Don Farrell ...",0.3182,positive,The Edge Malaysia,my,Malaysia
2025-05-16 02:35:00+00:00,Malaysia's export base to cushion US tariff impact - Bank Negara,"""Malaysia benefited from front-loading of exports as businesses try to avoid higher tariffs, and 32 per cent of our exports to the US are ...",-0.296,negative,thestar.com.my,my,Malaysia
2025-05-15 12:36:00+00:00,Government Unveils Support Measures for Businesses Amid US Tariff Concerns,State banks ordered to reduce profit targets and lower interest rates to assist exporters and SMEs.,0.7506,positive,Nation Thailand,th,Thailand
2025-05-19 04:11:50+00:00,"Vietnam, Thailand Announce Major Diplomatic Upgrade Amid US Tariff Threat","Vietnam and Thailand have upgraded their relations to a Comprehensive Strategic Partnership, pledging to deepen economic and security ties ...",0.0,neutral,The Diplomat – Asia-Pacific Current Affairs Magazine,us,United States
2025-05-21 01:08:30+00:00,Japan’s Exports Lose Steam Amid US Tariff Heat,"Japan's export growth slowed sharply in April, weighed down by the Trump administration's escalating tariff campaign and a stronger yen, ...",0.3612,positive,BusinessToday Malaysia,my,Malaysia
2025-05-16 01:46:27+00:00,Apec adopts joint statement on trade as tariffs overshadow meeting,"Apec warned at the start of the meeting that exports from a region that accounts for around half of world trade would slow sharply this year, in ...",-0.1027,negative,The Edge Malaysia,my,Malaysia
2025-05-19 22:59:49+00:00,Tariff cuts and trade talks: What we know so far,"Trump's new tariff policy could reduce rates for allies, reigniting vehicle trade talks with the EU, UK, China, India and Canada.",-0.296,negative,Automotive Logistics,gb,United Kingdom
2025-05-20 09:13:38+00:00,"Japan mulls accepting US tariff reduction, not exemption – Kyodo","Japanese media outlet, Kyodo News, reported on Tuesday that Japan is considering accepting lower US tariff rates and not demanding exemption ...",0.567,positive,FXStreet,es,Spain
2025-05-20 09:36:00+00:00,Taiwan’s president downplays tariff tensions with the US as ‘frictions between friends’,The Taiwanese president says trade tensions between the United States and Taiwan are just “frictions between friends.”,-0.3818,negative,AP News,us,United States
2025-05-15 00:32:31+00:00,Businesses upbeat over China-US tariff respite,BEIJING/WASHINGTON – Business groups and economists have welcomed the tariff adjustment measures announced by China and the United States on ...,0.6369,positive,Asia News Network,sg,Singapore
2025-05-16 16:02:00+00:00,‘Not possible to…’: Donald Trump says US will set new tariff rates for several countries over next few weeks,"US President Donald Trump has announced he will unilaterally impose new tariff rates for partner nations, telling them “what they'll be ...",-0.296,negative,The Indian Express,in,India
2025-05-16 13:50:35+00:00,US Tariff Turmoil: Malaysia's solar manufacturers struggle amid tariff threats,"Malaysia, a key APEC economy, has ambitions to be a global solar manufacturing hub, but it is now under threat of US tariffs.",-0.836,negative,news.cgtn.com,cn,China
2025-05-15 12:02:12+00:00,News Shippers should check out the 'small print' in China-US tariff cuts,"Treasury secretary Scott Bessent announced on Monday that the US would cut tariffs on Chinese goods from 145% to 10%, plus a 20% fentanyl tariff ...",-0.3612,negative,The Loadstar,gb,United Kingdom
2025-05-14 15:46:00+00:00,"Chinese, US tariff adjustments take effect; Ports, exporters witness rapid trade rebound","China is scheduled to adjust tariffs on imported US products from 12:01 pm Wednesday, according to announcement of the Customs Tariff Commission ...",0.0,neutral,Global Times,cn,China
2025-05-20 15:44:00+00:00,"US tariffs on solar gear from SE Asian countries, including Malaysia, hit up to 3,521% after panel vote","US duties on solar equipment from four Southeast Asian countries are now set to take effect, following a government trade commission's ...",0.0,neutral,The Edge Malaysia,my,Malaysia
2025-05-21 07:56:02+00:00,Insights | U.S. tariff policies will backfire on its domestic economy: Filipino scholar,,0.0,neutral,Ecns.cn,cn,China
2025-05-16 08:10:56+00:00,"U.S. vs. China Tariffs: Trump’s Latest Trade War, Explained",The United States and China said Monday they would temporarily slash tariffs in an effort to reduce global trade tensions.,-0.7096,negative,The New York Times,us,United States
2025-05-16 17:47:21+00:00,"Trump says US will set new tariff rates for countries, skirting negotiations","Trump slapped roughly 60 trading partners with so-called reciprocal tariffs of up to 50 percent in April, while imposing a baseline 10 percent ...",-0.1027,negative,Politico,us,United States
2025-05-14 17:29:13+00:00,"Trump's trade war wins so far: More talk, uncertainty and deadlines","“Thanks to President Trump's tariffs and dealmaking, the U.K. has opened up billions in export opportunities for American ranchers and farmers ...",-0.0717,negative,NBC News,us,United States
2025-05-14 16:25:30+00:00,Historic U.S.-UK Trade Deal Draws Praise,"This agreement lowers trade barriers, opening $5 billion of increased market access for American exports, especially for American farmers. Thank ...",0.8873,positive,United States Trade Representative (.gov),us,United States
2025-05-17 00:03:00+00:00,Trump Says U.S. Will Set Tariff Rates in Coming Weeks,"President Trump said the U.S. will unilaterally set tariffs for many countries soon. Speaking on his Middle East tour, the president said ...",0.0,neutral,WSJ,us,United States
2025-05-16 13:51:09+00:00,Trump says U.S. will set tariff rates for most nations within weeks,"President Trump said his administration ""will be sending letters out"" in two to three weeks to alert other nations of the tariff rates the ...",0.296,positive,CBS News,us,United States
2025-05-15 12:30:09+00:00,Trump Pokes at India Again With Claims on Tariffs and Technology,President Trump suggested that New Delhi was ready to charge the United States “no tariff.” India's foreign minister said that the two countries ...,0.6486,positive,The New York Times,us,United States
2025-05-19 18:52:29+00:00,Economists say Trump's tariffs are unpredictable and still working their way through the system,"Trump's tariffs are still huge, unpredictable and working their way through the system.",0.3182,positive,PBS,us,United States
2025-05-17 09:00:00+00:00,Gone in 40 days: how Trump’s ‘liberation day’ tariff assault unraveled,"The impact of those six chaotic weeks, from higher prices to slowing growth, is still unfolding, and the story continues.",-0.6597,negative,The Guardian,gb,United Kingdom
2025-05-20 09:00:00+00:00,Trump has imposed a lot of tariffs. But here's why collecting them can be hard,"U.S. Customs and Border Protection, or CBP, is the primary federal agency that screens imports and determines if a tariff should be collected.",-0.1901,negative,NPR,us,United States
2025-05-16 13:30:23+00:00,"Trump: U.S. will set tariff rates in 2-3 weeks, can't negotiate with everyone","President Trump said Friday the U.S. will unilaterally set tariff rates for many trading partners in the coming weeks, citing a lack of ...",-0.3182,negative,Axios,us,United States
2025-05-14 09:20:13+00:00,What to Know About Trump’s Latest Changes to Taxes on Small Packages From China,"Beginning Wednesday, shipments arriving in the United States from China and Hong Kong worth less than $800 could face 54 percent tariffs.",0.5719,positive,The New York Times,us,United States
2025-05-18 04:01:00+00:00,U.S. Allies Are Still Waiting for Tariff Relief Even After Speedy China Truce,"Talks with Japan, South Korea and European Union bog down over auto tariffs and U.S. reneging on past deals.",0.4767,positive,WSJ,us,United States
